[
  {
    "name": "Atlanta Hawks",
    "short_name": "Hawks",
    "abbreviation": "ATL",
    "sport": "nba",
    "metadata": {
      "conference": "Eastern",
      "division": "Southeast",
      "team_color_primary": "#c8102e",
      "team_color_secondary": "#fdb927",
      "logo_url": "https://a.espncdn.com/i/teamlogos/nba/500/atl.png",
      "espn_team_id": "1",
      "arena": "State Farm Arena",
      "arena_city": "Atlanta",
      "arena_state": "GA",
      "head_coach": "Quin Snyder"
    },
    "aliases": [
      {
        "alias": "Atlanta Hawks",
        "source_id": "global"
      },
      {
        "alias": "Hawks",
        "source_id": "global"
      },
      {
        "alias": "ATL",
        "source_id": "global"
      },
      {
        "alias": "Atlanta",
        "source_id": "espn_nba"
      },
      {
        "alias": "ATL Hawks",
        "source_id": "balldontlie_nba"
      }
    ],
    "id": "nba-atl"
  },
  {
    "name": "Boston Celtics",
    "short_name": "Celtics",
    "abbreviation": "BOS",
    "sport": "nba",
    "metadata": {
      "conference": "Eastern",
      "division": "Atlantic",
      "team_color_primary": "#008348",
      "team_color_secondary": "#ffffff",
      "logo_url": "https://a.espncdn.com/i/teamlogos/nba/500/bos.png",
      "espn_team_id": "2",
      "arena": "TD Garden",
      "arena_city": "Boston",
      "arena_state": "MA",
      "head_coach": "Joe Mazzulla"
    },
    "aliases": [
      {
        "alias": "Boston Celtics",
        "source_id": "global"
      },
      {
        "alias": "Celtics",
        "source_id": "global"
      },
      {
        "alias": "BOS",
        "source_id": "global"
      },
      {
        "alias": "Boston",
        "source_id": "espn_nba"
      },
      {
        "alias": "BOS Celtics",
        "source_id": "balldontlie_nba"
      }
    ],
    "id": "nba-bos"
  },
  {
    "name": "Brooklyn Nets",
    "short_name": "Nets",
    "abbreviation": "BKN",
    "sport": "nba",
    "metadata": {
      "conference": "Eastern",
      "division": "Atlantic",
      "team_color_primary": "#000000",
      "team_color_secondary": "#ffffff",
      "logo_url": "https://a.espncdn.com/i/teamlogos/nba/500/bkn.png",
      "espn_team_id": "17",
      "arena": "Prudential Center",
      "arena_city": "Newark",
      "arena_state": "NJ",
      "head_coach": "Jordi Fernandez"
    },
    "aliases": [
      {
        "alias": "Brooklyn Nets",
        "source_id": "global"
      },
      {
        "alias": "Nets",
        "source_id": "global"
      },
      {
        "alias": "BKN",
        "source_id": "global"
      },
      {
        "alias": "Brooklyn",
        "source_id": "espn_nba"
      },
      {
        "alias": "BKN Nets",
        "source_id": "balldontlie_nba"
      },
      {
        "alias": "NJN",
        "source_id": "nbacom_cdn"
      }
    ],
    "id": "nba-bkn"
  },
  {
    "name": "Charlotte Hornets",
    "short_name": "Hornets",
    "abbreviation": "CHA",
    "sport": "nba",
    "metadata": {
      "conference": "Eastern",
      "division": "Southeast",
      "team_color_primary": "#008ca8",
      "team_color_secondary": "#1d1060",
      "logo_url": "https://a.espncdn.com/i/teamlogos/nba/500/cha.png",
      "espn_team_id": "30",
      "arena": "Spectrum Center",
      "arena_city": "Charlotte",
      "arena_state": "NC",
      "head_coach": "Charles Lee"
    },
    "aliases": [
      {
        "alias": "Charlotte Hornets",
        "source_id": "global"
      },
      {
        "alias": "Hornets",
        "source_id": "global"
      },
      {
        "alias": "CHA",
        "source_id": "global"
      },
      {
        "alias": "Charlotte",
        "source_id": "espn_nba"
      },
      {
        "alias": "CHA Hornets",
        "source_id": "balldontlie_nba"
      },
      {
        "alias": "CHO",
        "source_id": "nbacom_cdn"
      }
    ],
    "id": "nba-cha"
  },
  {
    "name": "Chicago Bulls",
    "short_name": "Bulls",
    "abbreviation": "CHI",
    "sport": "nba",
    "metadata": {
      "conference": "Eastern",
      "division": "Central",
      "team_color_primary": "#ce1141",
      "team_color_secondary": "#000000",
      "logo_url": "https://a.espncdn.com/i/teamlogos/nba/500/chi.png",
      "espn_team_id": "4",
      "arena": "United Center",
      "arena_city": "Chicago",
      "arena_state": "IL",
      "head_coach": "Billy Donovan"
    },
    "aliases": [
      {
        "alias": "Chicago Bulls",
        "source_id": "global"
      },
      {
        "alias": "Bulls",
        "source_id": "global"
      },
      {
        "alias": "CHI",
        "source_id": "global"
      },
      {
        "alias": "Chicago",
        "source_id": "espn_nba"
      },
      {
        "alias": "CHI Bulls",
        "source_id": "balldontlie_nba"
      }
    ],
    "id": "nba-chi"
  },
  {
    "name": "Cleveland Cavaliers",
    "short_name": "Cavaliers",
    "abbreviation": "CLE",
    "sport": "nba",
    "metadata": {
      "conference": "Eastern",
      "division": "Central",
      "team_color_primary": "#860038",
      "team_color_secondary": "#bc945c",
      "logo_url": "https://a.espncdn.com/i/teamlogos/nba/500/cle.png",
      "espn_team_id": "5",
      "arena": "Rocket Arena",
      "arena_city": "Cleveland",
      "arena_state": "OH",
      "head_coach": "Kenny Atkinson"
    },
    "aliases": [
      {
        "alias": "Cleveland Cavaliers",
        "source_id": "global"
      },
      {
        "alias": "Cavaliers",
        "source_id": "global"
      },
      {
        "alias": "CLE",
        "source_id": "global"
      },
      {
        "alias": "Cleveland",
        "source_id": "espn_nba"
      },
      {
        "alias": "Cavs",
        "source_id": "global"
      },
      {
        "alias": "CLE Cavaliers",
        "source_id": "balldontlie_nba"
      }
    ],
    "id": "nba-cle"
  },
  {
    "name": "Dallas Mavericks",
    "short_name": "Mavericks",
    "abbreviation": "DAL",
    "sport": "nba",
    "metadata": {
      "conference": "Western",
      "division": "Southwest",
      "team_color_primary": "#0064b1",
      "team_color_secondary": "#bbc4ca",
      "logo_url": "https://a.espncdn.com/i/teamlogos/nba/500/dal.png",
      "espn_team_id": "6",
      "arena": "American Airlines Center",
      "arena_city": "Dallas",
      "arena_state": "TX",
      "head_coach": "Jason Kidd"
    },
    "aliases": [
      {
        "alias": "Dallas Mavericks",
        "source_id": "global"
      },
      {
        "alias": "Mavericks",
        "source_id": "global"
      },
      {
        "alias": "DAL",
        "source_id": "global"
      },
      {
        "alias": "Dallas",
        "source_id": "espn_nba"
      },
      {
        "alias": "Mavs",
        "source_id": "global"
      },
      {
        "alias": "DAL Mavericks",
        "source_id": "balldontlie_nba"
      }
    ],
    "id": "nba-dal"
  },
  {
    "name": "Denver Nuggets",
    "short_name": "Nuggets",
    "abbreviation": "DEN",
    "sport": "nba",
    "metadata": {
      "conference": "Western",
      "division": "Northwest",
      "team_color_primary": "#0e2240",
      "team_color_secondary": "#fec524",
      "logo_url": "https://a.espncdn.com/i/teamlogos/nba/500/den.png",
      "espn_team_id": "7",
      "arena": "Ball Arena",
      "arena_city": "Denver",
      "arena_state": "CO",
      "head_coach": "David Adelman"
    },
    "aliases": [
      {
        "alias": "Denver Nuggets",
        "source_id": "global"
      },
      {
        "alias": "Nuggets",
        "source_id": "global"
      },
      {
        "alias": "DEN",
        "source_id": "global"
      },
      {
        "alias": "Denver",
        "source_id": "espn_nba"
      },
      {
        "alias": "DEN Nuggets",
        "source_id": "balldontlie_nba"
      }
    ],
    "id": "nba-den"
  },
  {
    "name": "Detroit Pistons",
    "short_name": "Pistons",
    "abbreviation": "DET",
    "sport": "nba",
    "metadata": {
      "conference": "Eastern",
      "division": "Central",
      "team_color_primary": "#1d428a",
      "team_color_secondary": "#c8102e",
      "logo_url": "https://a.espncdn.com/i/teamlogos/nba/500/det.png",
      "espn_team_id": "8",
      "arena": "Little Caesars Arena",
      "arena_city": "",
      "arena_state": "",
      "head_coach": "J.B. Bickerstaff"
    },
    "aliases": [
      {
        "alias": "Detroit Pistons",
        "source_id": "global"
      },
      {
        "alias": "Pistons",
        "source_id": "global"
      },
      {
        "alias": "DET",
        "source_id": "global"
      },
      {
        "alias": "Detroit",
        "source_id": "espn_nba"
      },
      {
        "alias": "DET Pistons",
        "source_id": "balldontlie_nba"
      }
    ],
    "id": "nba-det"
  },
  {
    "name": "Golden State Warriors",
    "short_name": "Warriors",
    "abbreviation": "GSW",
    "sport": "nba",
    "metadata": {
      "conference": "Western",
      "division": "Pacific",
      "team_color_primary": "#fdb927",
      "team_color_secondary": "#1d428a",
      "logo_url": "https://a.espncdn.com/i/teamlogos/nba/500/gs.png",
      "espn_team_id": "9",
      "arena": "Oracle Arena",
      "arena_city": "Oakland",
      "arena_state": "CA",
      "head_coach": "Steve Kerr"
    },
    "aliases": [
      {
        "alias": "Golden State Warriors",
        "source_id": "global"
      },
      {
        "alias": "Warriors",
        "source_id": "global"
      },
      {
        "alias": "GSW",
        "source_id": "global"
      },
      {
        "alias": "Golden State",
        "source_id": "espn_nba"
      },
      {
        "alias": "GS Warriors",
        "source_id": "balldontlie_nba"
      },
      {
        "alias": "GS",
        "source_id": "nbacom_cdn"
      }
    ],
    "id": "nba-gsw"
  },
  {
    "name": "Houston Rockets",
    "short_name": "Rockets",
    "abbreviation": "HOU",
    "sport": "nba",
    "metadata": {
      "conference": "Western",